{
  "schemaVersion": 1,
  "updatedAt": "2026-10-02",
  "language": "es",
  "purpose": "Base documental interna para seleccionar y desarrollar contenido; no catálogo ejecutable ni prescripción individual.",
  "status": "documentary-draft",
  "runtimeIntegration": false,
  "professionalReview": false,
  "evidencePolicy": {
    "verified": "Solo el contenido efectivamente accesible y su alcance de lectura.",
    "proposed": "Diseño propio de tareas, adaptaciones y criterios; pendiente de probar.",
    "pending": "Visionado, ficha de autoría, carga, validación visual y transferencia que no estén acreditados.",
    "mediaRights": "Solo referencias y síntesis propias. Sin transcripciones, videos, capturas ni cursos incorporados.",
    "inferenceBoundary": "Las fuentes de una afirmación respaldan esa afirmación, no toda tarea vinculada ni su eficacia personal."
  },
  "sources": [
    {
      "id": "S01",
      "author": "7mlc",
      "title": "10 EASY Ball Mastery Exercises For Beginners",
      "url": "https://www.youtube.com/watch?v=e5RxAJM-oxc",
      "publishedAt": "2023-06-29",
      "consultedAt": "2026-10-02",
      "accessKind": "youtube-metadata",
      "inspectedScope": "Título, autor, descripción y capítulos mediante navegador; no secuencia completa visionada.",
      "limit": "Coordinación individual como tema; no identificar cada ejercicio por su número ni inferir eficacia de etiquetas."
    },
    {
      "id": "S02",
      "author": "7mlc",
      "title": "7MLC Training",
      "url": "https://www.7mlctraining.com/",
      "publishedAt": "unknown",
      "consultedAt": "2026-10-02",
      "accessKind": "publisher-text",
      "inspectedScope": "Portada pública y categorías de entrenamiento.",
      "limit": "Catálogo del proveedor; no ensayo de eficacia ni acceso a cursos."
    },
    {
      "id": "S03",
      "author": "Become Elite",
      "title": "The Elite 90",
      "url": "https://www.become-elite.com/products/the-elite-90",
      "publishedAt": "unknown",
      "consultedAt": "2026-10-02",
      "accessKind": "commercial-description",
      "inspectedScope": "Descripción comercial pública del programa.",
      "limit": "Integra componentes físicos y técnicos; programa completo, dosis y resultados no evaluados."
    },
    {
      "id": "S04",
      "author": "Become Elite",
      "title": "TestProof",
      "url": "https://www.become-elite.com/products/testproof",
      "publishedAt": "unknown",
      "consultedAt": "2026-10-02",
      "accessKind": "commercial-description",
      "inspectedScope": "Descripción pública del acondicionamiento y pruebas.",
      "limit": "Una promesa comercial o aprobar una prueba no demuestra preparación competitiva ni plazo personal."
    },
    {
      "id": "S05",
      "author": "Joner Football",
      "title": "Viral football drills",
      "url": "https://jonerfootball.com/blog/viral-football-drills/",
      "publishedAt": "2026-04-27",
      "consultedAt": "2026-10-02",
      "accessKind": "coaching-text",
      "inspectedScope": "Texto público de prácticas y comentario metodológico.",
      "limit": "Opinión de entrenador: valor de oposición y contexto; no prueba de superioridad universal."
    },
    {
      "id": "S06",
      "author": "My Personal Football Coach",
      "title": "The Philosophy",
      "url": "https://mypersonalfootballcoach.com/the-philosophy/",
      "publishedAt": "unknown",
      "consultedAt": "2026-10-02",
      "accessKind": "coaching-text",
      "inspectedScope": "Explicación pública de su modelo técnico.",
      "limit": "Modelo de enseñanza del proveedor; no se verifica su reclamo comercial de eficacia."
    },
    {
      "id": "S07",
      "author": "My Personal Football Coach",
      "title": "V Work Combo Diamond",
      "url": "https://mypersonalfootballcoach.com/individual-soccer-training-challenge-v-work-combo-diamond/",
      "publishedAt": "2016-10-06",
      "consultedAt": "2026-10-02",
      "accessKind": "coaching-text",
      "inspectedScope": "Descripción textual: marcadores, portería, ritmo progresivo y giro corporal.",
      "limit": "Video no visionado; la secuencia exacta y sus apoyos siguen pendientes."
    },
    {
      "id": "S08",
      "author": "My Personal Football Coach",
      "title": "Opposed Buddy Attack & Defend",
      "url": "https://mypersonalfootballcoach.com/1v1-soccer-drills-opposed-buddy-attack-defend-soccer-practice/",
      "publishedAt": "2016-09-09",
      "consultedAt": "2026-10-02",
      "accessKind": "coaching-text",
      "inspectedScope": "Texto de recepción con salida y conducción frente al defensor.",
      "limit": "No copiar todo el circuito ni tratar la finta como respuesta obligatoria."
    },
    {
      "id": "S09",
      "author": "Unisport",
      "title": "First touch: four drills / capítulos publicados",
      "url": "https://www.youtube.com/watch?v=gmN_Jjyb2rs",
      "publishedAt": "2023-06-02",
      "consultedAt": "2026-10-02",
      "accessKind": "youtube-description",
      "inspectedScope": "Descripción y capítulos indexados: 2:45, 3:30, 4:17 y 5:43.",
      "limit": "No visionado completo; los capítulos identifican temas, no certifican ejecución."
    },
    {
      "id": "S10",
      "author": "Unisport",
      "title": "Five first touch techniques for midfielders",
      "url": "https://www.unisportstore.com/stories/mastering-ball-first-touch-5-essential-techniques-for-midfielders/",
      "publishedAt": "2025-04-02",
      "consultedAt": "2026-10-02",
      "accessKind": "coaching-text",
      "inspectedScope": "Artículo técnico público.",
      "limit": "La superficie y orientación dependen de presión/opciones; no adoptar sus afirmaciones absolutas."
    },
    {
      "id": "S11",
      "author": "AllAttack",
      "title": "10 Soccer Mistakes Every Beginner Makes",
      "url": "https://www.youtube.com/watch?v=3eTVbWVqpM8",
      "publishedAt": "2026-01-24",
      "consultedAt": "2026-10-02",
      "accessKind": "youtube-metadata",
      "inspectedScope": "Autor y capítulos confirmados en navegador: control, atención defensiva, decisiones, movimiento y fundamentos.",
      "limit": "No revisión audiovisual completa. No se extrajo transcripción; no se atribuyen correcciones detalladas."
    },
    {
      "id": "S12",
      "author": "Futsal Movement",
      "title": "Body shape when receiving the ball",
      "url": "https://www.youtube.com/watch?v=VkDQ4F9c6Fk",
      "publishedAt": "2018-08-18",
      "consultedAt": "2026-10-02",
      "accessKind": "youtube-description",
      "inspectedScope": "Descripción pública indexada del autor sobre orientación, opciones y tiempo.",
      "limit": "No se comprobó la secuencia audiovisual ni una dosis."
    },
    {
      "id": "S13",
      "author": "Futsal Movement",
      "title": "Sole of the foot",
      "url": "https://www.youtube.com/watch?v=TtdJPD7ImDc",
      "publishedAt": "unknown",
      "consultedAt": "2026-10-02",
      "accessKind": "title-only",
      "inspectedScope": "Identificación del título y canal.",
      "limit": "Solo candidato de visionado; no sustenta instrucciones técnicas."
    },
    {
      "id": "S14",
      "author": "FIFA",
      "title": "Futsal Coaching Manual",
      "url": "https://www.fifatrainingcentre.com/en/environment/resources/futsal/futsal-coaching-manual.php",
      "publishedAt": "2025-02-20",
      "consultedAt": "2026-10-02",
      "accessKind": "institutional-overview",
      "inspectedScope": "Página introductoria y estructura; acceso al PDF español fallido.",
      "limit": "No lectura íntegra del manual ni verificación de todas las reglas actuales."
    },
    {
      "id": "S15",
      "author": "FIFA",
      "title": "Futsal Fitness Manual",
      "url": "https://www.fifatrainingcentre.com/en/environment/resources/futsal/futsal-fitness-manual.php",
      "publishedAt": "2025-01-16",
      "consultedAt": "2026-10-02",
      "accessKind": "institutional-overview",
      "inspectedScope": "Introducción y resúmenes de capítulos.",
      "limit": "Demanda según roles, calendario y acciones; no se extrae dosificación del manual."
    },
    {
      "id": "S16",
      "author": "FIFA",
      "title": "Individual actions: Developing central midfielders",
      "url": "https://www.fifatrainingcentre.com/en/practice/talent-coach-programme/position-specific-training/individual-actions-developing-central-midfielders.php",
      "publishedAt": "2026-05-12",
      "consultedAt": "2026-10-02",
      "accessKind": "coaching-text",
      "inspectedScope": "Metodología, tareas y progresiones textuales.",
      "limit": "No video completo; ejercicios de campo, no transferencia demostrada desde 2×2."
    },
    {
      "id": "S17",
      "author": "FIFA",
      "title": "Finishing: From 1v1 to 3v3",
      "url": "https://www.fifatrainingcentre.com/en/practice/talent-coach-programme/create-and-finish/finishing-from-1v1-to-3v3.php",
      "publishedAt": "2024-12-31",
      "consultedAt": "2026-10-02",
      "accessKind": "coaching-text",
      "inspectedScope": "Metodología y secuencias de finalización con oposición.",
      "limit": "No copiar área, volumen ni restricciones como dosis individual."
    },
    {
      "id": "S18",
      "author": "FIFA",
      "title": "Defending in 1v1: Orientating attackers away from goal",
      "url": "https://www.fifatrainingcentre.com/en/practice/talent-coach-programme/deny-and-protect/defending-in-1v1-orientating-attackers-away-from-goal.php",
      "publishedAt": "2025-09-30",
      "consultedAt": "2026-10-02",
      "accessKind": "coaching-text",
      "inspectedScope": "Explicación, organización y puntos de aproximación/frenado.",
      "limit": "Orientar afuera responde a ese escenario, no a todos los duelos."
    },
    {
      "id": "S19",
      "author": "Jordet et al.",
      "title": "Scanning and performance across a season",